{"action_kinds":[],"annotation_count":0,"attachment_count":0,"clip_count":5,"crop_box":[0,0,255,90],"font_count":0,"form_count":18,"image_count":1,"images":[{"resource":"page/Svg0/xo0/xo15","classification":"source"}],"inventory_sha256":"24fb144a20ac0c847e4006e0d1f9bcd6b08a8c569be299fe3f42e0e7b05511eb","mapping_count":0,"mask_count":1,"media_box":[0,0,255,90],"operation_count":614,"operation_minimums":{"Do":18,"Q":68,"W":5,"c":179,"cm":34,"cs":22,"f":22,"gs":17,"h":30,"l":89,"m":32,"n":5,"q":68,"re":3,"scn":22},"operation_sha256":"7d6c10f0218fd386a581f7d7f147f520052c63489cc76ac7bbba51c7da1abe78","output_intent_count":1,"page_count":1,"pdf_version":"1.7","required_icc_tags":["rXYZ","gXYZ","bXYZ","wtpt","rTRC","gTRC","bTRC"],"schema":"excalidraw-render/pdf-structure-expectation/v1","xmp_present":false}
